{"schema_version":"1","id":"button","version":"1.0.0","name":"button","kind":"button","status":"stable","category":"action","intent":{"summary":"Invokes one discrete user action when activated.","useWhen":["A user intentionally triggers an immediate command"],"avoidWhen":["The interaction selects persistent state or navigates without command semantics"]},"semantics":{"role":"command control","childPolicy":"one label subtree describing the action","sizing":"at least the platform-independent minimum target; expands for label and padding","ordering":"occupies its declared document position"},"attributes":[{"name":"action","valueType":"binding","required":true,"description":"Command invoked exactly once per activation."},{"name":"label","valueType":"reference","required":true,"description":"Visible label subtree with an unambiguous accessible name."},{"name":"prominence","valueType":"enum","required":false,"description":"Relative emphasis within the surrounding action set.","defaultValue":"standard","allowedValues":["quiet","standard","prominent","destructive"]},{"name":"enabled","valueType":"binding","required":false,"description":"Whether activation is currently accepted.","defaultValue":"true"},{"name":"isDefault","valueType":"boolean","required":false,"description":"Whether the action is the scope's default keyboard action.","defaultValue":"false"}],"constraints":[{"expression":"label has a non-empty accessible name","message":"Every button requires an unambiguous action name."}],"accessibility":{"role":"button","nameSource":"label or explicit accessible name","focusBehavior":"focusable when enabled; operable by primary activation keys","notes":["Expose disabled, default, pressed, or expanded state when applicable."]},"mappings":[{"platform":"swiftui","constructs":["Button"],"strategy":"Separate action closure, label subtree, role, and enabled state.","caveats":[]},{"platform":"winui3","constructs":["Button","AppBarButton","HyperlinkButton"],"strategy":"Select the control from command and navigation semantics, not appearance alone.","caveats":[]},{"platform":"qt","constructs":["Button","ToolButton","QPushButton","QToolButton"],"strategy":"Map through Qt Quick or Qt Widgets constructs using the same layout intent and accessibility contract.","caveats":["Qt Quick and Qt Widgets differ in sizing, ownership, and event wiring."]}],"tags":["action","interactive","command"]}
