{"schema_version":"1","id":"text","version":"1.0.0","name":"text","kind":"text","status":"stable","category":"content","intent":{"summary":"Presents human-readable textual content with semantic typography and localization behavior.","useWhen":["Information is communicated as text"],"avoidWhen":["Text is solely an icon substitute without an accessible name"]},"semantics":{"role":"text content","childPolicy":"no visual children","sizing":"intrinsic to shaped text subject to wrapping, truncation, and parent constraints","ordering":"characters follow Unicode bidirectional and locale rules"},"attributes":[{"name":"content","valueType":"binding","required":true,"description":"Localized string or string-producing binding."},{"name":"style","valueType":"enum","required":false,"description":"Semantic typography role rather than a platform font name.","defaultValue":"body","allowedValues":["caption","body","label","heading","title","display","monospace"]},{"name":"lineLimit","valueType":"number","required":false,"description":"Maximum rendered line count; omission means unconstrained.","minimum":1,"maximum":1000},{"name":"alignment","valueType":"alignment","required":false,"description":"Inline alignment within the text bounds.","defaultValue":"start","allowedValues":["start","center","end"]},{"name":"overflow","valueType":"enum","required":false,"description":"Behavior when content exceeds available bounds.","defaultValue":"wrap","allowedValues":["wrap","truncate-start","truncate-middle","truncate-end","clip"]}],"constraints":[{"expression":"lineLimit is absent || lineLimit >= 1","message":"Line limit must be positive."}],"accessibility":{"role":"text","nameSource":"content","focusBehavior":"not focusable unless interactive semantics are added by another pattern","notes":["Preserve localization, reading direction, and dynamic text scaling."]},"mappings":[{"platform":"swiftui","constructs":["Text","Label"],"strategy":"Capture localized content, semantic font role, line policy, and alignment.","caveats":["Label may also contain an image and should be decomposed when necessary."]},{"platform":"winui3","constructs":["TextBlock"],"strategy":"Map content, text style resource, wrapping, trimming, and alignment.","caveats":[]},{"platform":"qt","constructs":["Text","Label","QLabel"],"strategy":"Map through Qt Quick or Qt Widgets constructs using the same layout intent and accessibility contract.","caveats":["Qt Quick and Qt Widgets differ in sizing, ownership, and event wiring."]}],"tags":["content","typography","localization"]}
