{
  "schema_version":"1","id":"overlay-stack","version":"1.0.0","name":"overlay stack","kind":"overlayStack","status":"stable","category":"layout",
  "intent":{"summary":"Places children in one shared bounds and paints later children above earlier children.","useWhen":["Content intentionally overlaps","A background, content, and adornment share bounds"],"avoidWhen":["Children should consume sequential space"]},
  "semantics":{"role":"layered container","childPolicy":"zero or more visual children sharing a coordinate space","sizing":"union of intrinsic child extents subject to parent constraints","ordering":"first child is backmost; last child is frontmost"},
  "attributes":[{"name":"alignment","valueType":"alignment","required":false,"description":"Anchor used to align each child within shared bounds.","defaultValue":"center","allowedValues":["top-start","top","top-end","start","center","end","bottom-start","bottom","bottom-end","stretch"]},{"name":"clipping","valueType":"boolean","required":false,"description":"Whether painting outside shared bounds is clipped.","defaultValue":"false"}],
  "constraints":[],
  "accessibility":{"role":"group","nameSource":"none unless semantically grouped","focusBehavior":"container is not focusable; descendant navigation follows semantic order","notes":["Paint order must not be assumed to define reading order."]},
  "mappings":[{"platform":"swiftui","constructs":["ZStack","overlay","background"],"strategy":"Normalize modifiers and ZStack children into explicit layers.","caveats":[]},{"platform":"winui3","constructs":["Grid","Canvas"],"strategy":"Use Grid for aligned layers and Canvas only for explicit coordinates.","caveats":["ZIndex may be required if insertion order changes."]}],"tags":["container","overlay","layering"]
}
