{"schema_version":"1","id":"range-control","version":"1.0.0","name":"range control","kind":"slider","status":"stable","category":"input","intent":{"summary":"Represents or edits a scalar value within a bounded numeric interval.","useWhen":["A value is meaningfully bounded and relative position matters"],"avoidWhen":["Exact unconstrained numeric entry is primary"]},"semantics":{"role":"bounded scalar control or indicator","childPolicy":"no visual children; associated labels are peers","sizing":"minimum operable track length or available parent extent","ordering":"minimum to maximum follows axis and locale direction"},"attributes":[{"name":"value","valueType":"binding","required":true,"description":"Current scalar value."},{"name":"minimum","valueType":"number","required":true,"description":"Inclusive lower bound."},{"name":"maximum","valueType":"number","required":true,"description":"Inclusive upper bound."},{"name":"step","valueType":"number","required":false,"description":"Smallest user-adjustable increment.","minimum":0},{"name":"mode","valueType":"enum","required":false,"description":"Whether the element is interactive or display-only.","defaultValue":"editable","allowedValues":["editable","indicator","indeterminate"]},{"name":"orientation","valueType":"enum","required":false,"description":"Primary value axis.","defaultValue":"horizontal","allowedValues":["horizontal","vertical"]}],"constraints":[{"expression":"minimum < maximum","message":"Range maximum must exceed minimum."},{"expression":"minimum <= value <= maximum","message":"Value must be inside the interval."},{"expression":"step is absent || step > 0","message":"Step must be positive when supplied."}],"accessibility":{"role":"slider for editable mode; progress indicator otherwise","nameSource":"associated label","focusBehavior":"focusable and keyboard-adjustable only in editable mode","notes":["Expose current, minimum, maximum, and formatted value."]},"mappings":[{"platform":"swiftui","constructs":["Slider","ProgressView","Gauge"],"strategy":"Normalize editing mode, bounds, step, and value presentation.","caveats":[]},{"platform":"winui3","constructs":["Slider","ProgressBar"],"strategy":"Select an interactive Slider or display-only ProgressBar from mode.","caveats":[]},{"platform":"qt","constructs":["Slider","ProgressBar","QSlider","QProgressBar"],"strategy":"Map through Qt Quick or Qt Widgets constructs using the same layout intent and accessibility contract.","caveats":["Qt Quick and Qt Widgets differ in sizing, ownership, and event wiring."]}],"tags":["input","range","progress"]}
