{"schema_version":"1","id":"split-view","version":"1.0.0","name":"split view","kind":"splitView","status":"stable","category":"layout","intent":{"summary":"Partitions available space into resizable adjacent panes separated by operable dividers.","useWhen":["Users need simultaneous panes","Pane proportions or visibility can change"],"avoidWhen":["Content is navigation overlay rather than a persistent pane"]},"semantics":{"role":"resizable pane group","childPolicy":"two or more pane children with dividers between adjacent panes","sizing":"pane sizes satisfy minimum, preferred, and maximum constraints within available space","ordering":"pane order follows the inline or block axis"},"attributes":[{"name":"axis","valueType":"enum","required":true,"description":"Axis along which panes are divided.","allowedValues":["horizontal","vertical"]},{"name":"dividerSize","valueType":"length","required":false,"description":"Visual divider thickness; hit target may be larger.","defaultValue":"1","minimum":0,"units":["logical-pixel"]},{"name":"resizable","valueType":"boolean","required":false,"description":"Whether users can resize panes.","defaultValue":"true"}],"constraints":[{"expression":"childCount >= 2","message":"A split view requires at least two panes."},{"expression":"pane.minimum <= pane.preferred <= pane.maximum","message":"Each pane sizing interval must be ordered."}],"accessibility":{"role":"group","nameSource":"application-defined pane group name","focusBehavior":"dividers are focusable only when resizable","notes":["Resizable dividers expose separator role, value, bounds, and keyboard adjustment."]},"mappings":[{"platform":"swiftui","constructs":["HSplitView","VSplitView","NavigationSplitView"],"strategy":"Capture pane order, axis, constraints, and resizing semantics.","caveats":["NavigationSplitView includes navigation policy beyond layout."]},{"platform":"winui3","constructs":["Grid","GridSplitter","SplitView"],"strategy":"Use constrained Grid tracks and operable splitters for simultaneous panes.","caveats":["WinUI SplitView is typically an overlay/navigation construct and is not always equivalent."]},{"platform":"qt","constructs":["SplitView","QSplitter"],"strategy":"Map through Qt Quick or Qt Widgets constructs using the same layout intent and accessibility contract.","caveats":["Qt Quick and Qt Widgets differ in sizing, ownership, and event wiring."]}],"tags":["container","panes","resizable"]}
