{"schema_version":"1","id":"image","version":"1.0.0","name":"image","kind":"image","status":"stable","category":"content","intent":{"summary":"Presents raster, vector, or symbolic visual content with explicit scaling and semantic purpose.","useWhen":["Visual content conveys information, identity, or decoration"],"avoidWhen":["A shape or text pattern more accurately describes the content"]},"semantics":{"role":"visual content","childPolicy":"no visual children","sizing":"intrinsic source size transformed by fit policy and parent constraints","ordering":"single visual object"},"attributes":[{"name":"source","valueType":"resource","required":true,"description":"Portable resource identifier or data binding, not an OS-specific filesystem path."},{"name":"contentMode","valueType":"enum","required":false,"description":"How source aspect ratio maps into destination bounds.","defaultValue":"fit","allowedValues":["intrinsic","fit","fill","stretch","tile"]},{"name":"purpose","valueType":"enum","required":true,"description":"Whether the image is informative, functional, or decorative.","allowedValues":["informative","functional","decorative"]},{"name":"accessibleName","valueType":"string","required":false,"description":"Localized equivalent for non-decorative visual meaning."}],"constraints":[{"expression":"purpose == decorative || accessibleName is present","message":"Non-decorative images require an accessible name."}],"accessibility":{"role":"image or none when decorative","nameSource":"accessibleName for informative images; owning control for functional images","focusBehavior":"not focusable unless composed into an interactive control","notes":["Decorative images are excluded from the accessibility tree."]},"mappings":[{"platform":"swiftui","constructs":["Image","AsyncImage"],"strategy":"Capture resource identity, resizability, aspect policy, and accessibility purpose.","caveats":["Remote loading is behavior outside layout metadata."]},{"platform":"winui3","constructs":["Image","FontIcon","PathIcon"],"strategy":"Select raster, vector, or symbolic representation from resource metadata.","caveats":[]},{"platform":"qt","constructs":["Image","QLabel with pixmap"],"strategy":"Map through Qt Quick or Qt Widgets constructs using the same layout intent and accessibility contract.","caveats":["Qt Quick and Qt Widgets differ in sizing, ownership, and event wiring."]}],"tags":["content","media","resource"]}
