{
  "schema_version":"1","id":"list","version":"1.0.0","name":"data list","kind":"list","status":"stable","category":"collection",
  "intent":{"summary":"Presents a repeatable, ordered collection of data-backed items with reusable item semantics.","useWhen":["Item identity and data-driven repetition matter","Selection or virtualization may be required"],"avoidWhen":["A small fixed group has no collection behavior"]},
  "semantics":{"role":"ordered collection","childPolicy":"an item template plus a data source; optional headers, footers, or sections","sizing":"viewport-constrained with item extents determined by template and layout policy","ordering":"data-source order unless an explicit sort is declared"},
  "attributes":[{"name":"items","valueType":"binding","required":true,"description":"Ordered data source with stable item identity."},{"name":"itemTemplate","valueType":"reference","required":true,"description":"Pattern subtree instantiated for each item."},{"name":"selectionMode","valueType":"enum","required":false,"description":"Permitted selection cardinality.","defaultValue":"none","allowedValues":["none","single","multiple"]},{"name":"virtualization","valueType":"enum","required":false,"description":"Realization policy for off-screen items.","defaultValue":"automatic","allowedValues":["automatic","enabled","disabled"]}],
  "constraints":[{"expression":"each item has stable identity","message":"Data-backed items require stable identity for updates and selection."}],
  "accessibility":{"role":"list","nameSource":"visible collection label or application-defined name","focusBehavior":"items use platform collection navigation and selection semantics","notes":["Expose item position, set size when known, and selection state."]},
  "mappings":[{"platform":"swiftui","constructs":["List","Table","ForEach"],"strategy":"Separate collection data, identity, template, selection, and layout.","caveats":["Table adds column semantics."]},{"platform":"winui3","constructs":["ListView","ItemsRepeater"],"strategy":"Use ListView for selection and collection behavior; ItemsRepeater for custom layout.","caveats":["ItemsRepeater does not supply selection semantics by itself."]}],"tags":["collection","data","virtualization"]
}
