{
  "schema_version":"1","id":"scroll-region","version":"1.0.0","name":"scroll region","kind":"scrollView","status":"stable","category":"layout",
  "intent":{"summary":"Provides a viewport over content whose resolved extent may exceed available space.","useWhen":["Content must remain reachable when larger than its viewport"],"avoidWhen":["All content must participate in the parent extent without independent scrolling"]},
  "semantics":{"role":"scrollable viewport","childPolicy":"one logical content subtree; multiple children require an explicit grouping container","sizing":"viewport is parent-constrained; content may exceed enabled axes","ordering":"content order is unchanged by scrolling"},
  "attributes":[{"name":"axes","valueType":"enum","required":false,"description":"Axes on which content may scroll.","defaultValue":"vertical","allowedValues":["vertical","horizontal","both"]},{"name":"indicatorPolicy","valueType":"enum","required":false,"description":"Visibility policy for scroll position indicators.","defaultValue":"automatic","allowedValues":["automatic","visible","hidden"]},{"name":"initialOffset","valueType":"number","required":false,"description":"Initial logical offset on the primary axis.","defaultValue":"0","minimum":0,"units":["logical-pixel"]}],
  "constraints":[{"expression":"initialOffset >= 0","message":"Initial offset cannot be negative."}],
  "accessibility":{"role":"scroll area","nameSource":"nearby label or application-defined name when needed","focusBehavior":"viewport participates in keyboard scrolling; focusable descendants remain reachable","notes":["Focus movement must reveal the focused descendant."]},
  "mappings":[{"platform":"swiftui","constructs":["ScrollView"],"strategy":"Preserve axes, indicator policy, and content subtree.","caveats":[]},{"platform":"winui3","constructs":["ScrollViewer"],"strategy":"Map enabled axes and scrollbar visibility directly.","caveats":["Nested scrolling requires explicit chaining policy."]}],"tags":["container","viewport","scrolling"]
}
