{"schema_version":"1","id":"grid","version":"1.0.0","name":"grid","kind":"grid","status":"stable","category":"layout","intent":{"summary":"Places children in addressable rows and columns with shared track sizing.","useWhen":["Two-dimensional alignment is required","Items share row or column measurements"],"avoidWhen":["A simple sequential stack expresses the layout"]},"semantics":{"role":"two-dimensional track container","childPolicy":"zero or more children, each occupying one or more tracks","sizing":"tracks may be intrinsic, fixed, proportional, or constrained","ordering":"semantic order is independent of cell coordinates and defaults to document order"},"attributes":[{"name":"rows","valueType":"string","required":true,"description":"Ordered row track definitions using intrinsic, fixed, proportional, or constrained sizing."},{"name":"columns","valueType":"string","required":true,"description":"Ordered column track definitions using intrinsic, fixed, proportional, or constrained sizing."},{"name":"rowSpacing","valueType":"length","required":false,"description":"Gap between row tracks.","defaultValue":"0","minimum":0,"units":["logical-pixel","design-token"]},{"name":"columnSpacing","valueType":"length","required":false,"description":"Gap between column tracks.","defaultValue":"0","minimum":0,"units":["logical-pixel","design-token"]}],"constraints":[{"expression":"rowSpacing >= 0 && columnSpacing >= 0","message":"Track spacing cannot be negative."},{"expression":"each child span is within declared tracks","message":"Child placement must reference existing tracks."}],"accessibility":{"role":"group","nameSource":"context dependent","focusBehavior":"container is not focusable; children follow declared semantic order","notes":["Do not infer reading order solely from coordinates."]},"mappings":[{"platform":"swiftui","constructs":["Grid","LazyVGrid","LazyHGrid"],"strategy":"Normalize GridItem and cell placement into tracks and spans.","caveats":["Lazy variants carry virtualization policy."]},{"platform":"winui3","constructs":["Grid","ItemsRepeater"],"strategy":"Map tracks to row and column definitions; use an items layout for repeated data.","caveats":[]},{"platform":"qt","constructs":["Grid","GridLayout","QGridLayout"],"strategy":"Map through Qt Quick or Qt Widgets constructs using the same layout intent and accessibility contract.","caveats":["Qt Quick and Qt Widgets differ in sizing, ownership, and event wiring."]}],"tags":["container","tracks","two-dimensional"]}
