{
  "schema_version":"1","id":"component-reference","version":"1.0.0","name":"component reference","kind":"component","status":"stable","category":"structure",
  "intent":{"summary":"References a separately defined semantic UI subtree through a stable component contract.","useWhen":["A reusable or independently translated component occupies this position"],"avoidWhen":["The referenced content has no stable identity or contract"]},
  "semantics":{"role":"structural reference","childPolicy":"resolved component root supplies children; inline children are prohibited","sizing":"resolved component participates normally in parent constraints","ordering":"occupies one position in its parent's semantic order"},
  "attributes":[{"name":"componentId","valueType":"reference","required":true,"description":"Stable identifier of the referenced component definition."},{"name":"inputs","valueType":"binding","required":false,"description":"Named data and configuration inputs passed to the component."},{"name":"identity","valueType":"string","required":false,"description":"Stable instance identity when state preservation requires it."}],
  "constraints":[{"expression":"componentId resolves exactly once","message":"A component reference must resolve to one definition."},{"expression":"reference graph is acyclic","message":"Component references cannot form an unbounded cycle."}],
  "accessibility":{"role":"none","nameSource":"resolved component","focusBehavior":"resolved descendants determine focus behavior","notes":["The reference wrapper does not create an accessibility node."]},
  "mappings":[{"platform":"swiftui","constructs":["custom View","computed View property"],"strategy":"Resolve declarations and bind constructor arguments to component inputs.","caveats":[]},{"platform":"winui3","constructs":["UserControl","DataTemplate","custom Control"],"strategy":"Select a generated or mapped target component with an explicit contract.","caveats":["Code-behind behavior is outside the layout pattern."]}],"tags":["structure","component","reuse"]
}
