{"schema_version":"1","id":"text-input","version":"1.0.0","name":"text input","kind":"textField","status":"stable","category":"input","intent":{"summary":"Accepts and edits textual user input bound to application state.","useWhen":["Users must enter or modify text"],"avoidWhen":["The value comes from a small closed set better represented by a choice control"]},"semantics":{"role":"editable text field","childPolicy":"no visual children; label and supporting text are associated peers","sizing":"minimum interactive target with content-driven or parent-constrained width","ordering":"text follows locale and input-method rules"},"attributes":[{"name":"value","valueType":"binding","required":true,"description":"Readable and writable text value."},{"name":"label","valueType":"string","required":true,"description":"Persistent accessible purpose of the field."},{"name":"placeholder","valueType":"string","required":false,"description":"Transient example or hint; never the only label."},{"name":"contentType","valueType":"enum","required":false,"description":"Semantic input purpose used for keyboard, autofill, and validation hints.","defaultValue":"plain","allowedValues":["plain","password","email","url","telephone","search","numeric"]},{"name":"multiline","valueType":"boolean","required":false,"description":"Whether line breaks are accepted.","defaultValue":"false"},{"name":"readOnly","valueType":"boolean","required":false,"description":"Whether editing is disabled while selection remains available.","defaultValue":"false"}],"constraints":[{"expression":"label is non-empty","message":"Every text input requires a persistent accessible label."}],"accessibility":{"role":"text field","nameSource":"label","focusBehavior":"focusable and editable unless disabled or read-only","notes":["Expose required, invalid, protected, and help states when applicable."]},"mappings":[{"platform":"swiftui","constructs":["TextField","SecureField","TextEditor"],"strategy":"Capture binding, label, prompt, content purpose, and multiline policy.","caveats":[]},{"platform":"winui3","constructs":["TextBox","PasswordBox","AutoSuggestBox"],"strategy":"Select control from contentType and multiline semantics.","caveats":["PasswordBox binding behavior differs from TextBox."]},{"platform":"qt","constructs":["TextField","TextArea","QLineEdit","QTextEdit"],"strategy":"Map through Qt Quick or Qt Widgets constructs using the same layout intent and accessibility contract.","caveats":["Qt Quick and Qt Widgets differ in sizing, ownership, and event wiring."]}],"tags":["input","text","form"]}
