{"schema_version":"1","id":"vertical-stack","version":"1.0.0","name":"vertical stack","kind":"verticalStack","status":"stable","category":"layout","intent":{"summary":"Arranges children sequentially from block-start to block-end on the vertical axis.","useWhen":["Sibling order is meaningful and vertical","Content height should be the sum of child extents and gaps"],"avoidWhen":["Children must overlap","Rows require two-dimensional placement"]},"semantics":{"role":"ordered one-dimensional container","childPolicy":"zero or more visual children","sizing":"cross-axis size is the maximum child extent; main-axis size is children plus gaps","ordering":"document order from top to bottom in left-to-right and right-to-left locales"},"attributes":[{"name":"spacing","valueType":"length","required":false,"description":"Gap between adjacent children.","defaultValue":"0","minimum":0,"units":["logical-pixel","design-token"]},{"name":"alignment","valueType":"alignment","required":false,"description":"Cross-axis alignment of children.","defaultValue":"center","allowedValues":["start","center","end","stretch"]}],"constraints":[{"expression":"spacing >= 0","message":"Spacing cannot be negative."}],"accessibility":{"role":"group","nameSource":"none unless the group has independent meaning","focusBehavior":"container is not focusable; descendants retain document order","notes":["Visual and accessibility order must agree."]},"mappings":[{"platform":"swiftui","constructs":["VStack","LazyVStack"],"strategy":"Preserve child order, spacing, and horizontal alignment.","caveats":["Lazy realization is a performance policy, not semantic identity."]},{"platform":"winui3","constructs":["Grid","StackPanel"],"strategy":"Use rows when sizing constraints matter; otherwise a vertical StackPanel is valid.","caveats":["StackPanel measures unbounded on its main axis."]},{"platform":"qt","constructs":["Column","ColumnLayout","QVBoxLayout"],"strategy":"Map through Qt Quick or Qt Widgets constructs using the same layout intent and accessibility contract.","caveats":["Qt Quick and Qt Widgets differ in sizing, ownership, and event wiring."]}],"tags":["container","linear","vertical"]}
