{
  "schema_version":"1","id":"spacer","version":"1.0.0","name":"flexible spacer","kind":"spacer","status":"stable","category":"layout",
  "intent":{"summary":"Consumes available free space along a parent layout axis without adding visible or semantic content.","useWhen":["Sibling separation should flex with available space"],"avoidWhen":["A fixed gap or alignment rule expresses the intent"]},
  "semantics":{"role":"non-visual flexible space","childPolicy":"no children","sizing":"grows from minimum toward available free space according to weight","ordering":"occupies a layout position but not a semantic position"},
  "attributes":[{"name":"minimum","valueType":"length","required":false,"description":"Smallest permitted extent on the parent main axis.","defaultValue":"0","minimum":0,"units":["logical-pixel","design-token"]},{"name":"weight","valueType":"number","required":false,"description":"Relative share of free space among sibling spacers.","defaultValue":"1","minimum":0.000001,"maximum":1000000}],
  "constraints":[{"expression":"minimum >= 0 && weight > 0","message":"Spacer minimum is non-negative and weight is positive."}],
  "accessibility":{"role":"none","nameSource":"none","focusBehavior":"not focusable and absent from accessibility tree","notes":[]},
  "mappings":[{"platform":"swiftui","constructs":["Spacer"],"strategy":"Capture minimum length and infer the parent main axis.","caveats":[]},{"platform":"winui3","constructs":["Grid star track"],"strategy":"Represent as proportional free-space track rather than a visible element.","caveats":[]}],"tags":["layout","flexible","non-visual"]
}
