{"schema_version":"1","id":"horizontal-stack","version":"1.0.0","name":"horizontal stack","kind":"horizontalStack","status":"stable","category":"layout","intent":{"summary":"Arranges children sequentially on the locale-aware inline axis.","useWhen":["Sibling order is meaningful and horizontal","Content width should be the sum of child extents and gaps"],"avoidWhen":["Children must overlap","Columns require two-dimensional placement"]},"semantics":{"role":"ordered one-dimensional container","childPolicy":"zero or more visual children","sizing":"cross-axis size is the maximum child extent; main-axis size is children plus gaps","ordering":"document order follows locale direction unless explicitly fixed"},"attributes":[{"name":"spacing","valueType":"length","required":false,"description":"Gap between adjacent children.","defaultValue":"0","minimum":0,"units":["logical-pixel","design-token"]},{"name":"alignment","valueType":"alignment","required":false,"description":"Cross-axis alignment of children.","defaultValue":"center","allowedValues":["start","center","end","baseline","stretch"]},{"name":"direction","valueType":"enum","required":false,"description":"Inline progression policy.","defaultValue":"locale","allowedValues":["locale","left-to-right","right-to-left"]}],"constraints":[{"expression":"spacing >= 0","message":"Spacing cannot be negative."}],"accessibility":{"role":"group","nameSource":"none unless the group has independent meaning","focusBehavior":"container is not focusable; descendants retain semantic order","notes":["Do not reverse accessibility order solely for visual mirroring."]},"mappings":[{"platform":"swiftui","constructs":["HStack","LazyHStack"],"strategy":"Preserve child order, spacing, vertical alignment, and layout direction.","caveats":[]},{"platform":"winui3","constructs":["Grid","StackPanel"],"strategy":"Use columns when sizing constraints matter; otherwise a horizontal StackPanel is valid.","caveats":["FlowDirection must reflect the direction policy."]},{"platform":"qt","constructs":["Row","RowLayout","QHBoxLayout"],"strategy":"Map through Qt Quick or Qt Widgets constructs using the same layout intent and accessibility contract.","caveats":["Qt Quick and Qt Widgets differ in sizing, ownership, and event wiring."]}],"tags":["container","linear","horizontal"]}
